{
  "$schema": "https://json-schema.org/draft/2020-12/schema",
  "$id": "https://agentic-sdlc.dev/schemas/v1/promotion.schema.json",
  "title": "Promotion",
  "type": "object",
  "additionalProperties": false,
  "required": [
    "id",
    "task_id",
    "schema_version",
    "stage",
    "readiness",
    "blocking_issues",
    "required_approvals",
    "granted_approvals",
    "summary",
    "artifacts",
    "updated_at"
  ],
  "properties": {
    "schema_version": {
      "const": "v1"
    },
    "id": {
      "type": "string"
    },
    "task_id": {
      "type": "string"
    },
    "stage": {
      "type": "string",
      "enum": ["draft", "ready_for_pr", "pr_created", "approved", "merged", "deployed"]
    },
    "readiness": {
      "type": "string",
      "enum": ["blocked", "needs_review", "ready"]
    },
    "blocking_issues": {
      "type": "array",
      "items": {
        "type": "string"
      }
    },
    "required_approvals": {
      "type": "array",
      "items": {
        "type": "string"
      }
    },
    "granted_approvals": {
      "type": "array",
      "items": {
        "type": "string"
      }
    },
    "summary": {
      "type": "string"
    },
    "artifacts": {
      "type": "array",
      "items": {
        "type": "string"
      }
    },
    "updated_at": {
      "type": "string",
      "format": "date-time"
    }
  }
}
