{
  "schema_version": "v1",
  "id": "promo-docs-001",
  "task_id": "task-docs-001",
  "stage": "ready_for_pr",
  "readiness": "ready",
  "blocking_issues": [],
  "required_approvals": ["maintainer-review"],
  "granted_approvals": [],
  "summary": "Documentation restructure is ready to be proposed for review.",
  "artifacts": ["artifact-docs-001"],
  "updated_at": "2026-04-11T13:16:33Z"
}
